{
  "$schema": "https://json-schema.org/draft/2020-12/schema",
  "$id": "https://raw.githubusercontent.com/civico-de/civikitchen/main/packages/civicrm-profile-schema/profile.schema.json",
  "title": "civikitchen profile",
  "description": "Canonical shape of docker/profiles/<name>/profile.json — the declarative description of a civikitchen scenario (extensions, authx, API users, and declarative content). This is the single source of truth for the format; any tool that reads or writes these profiles validates against this schema.",
  "type": "object",
  "additionalProperties": false,
  "required": ["description", "dependencies"],
  "properties": {
    "description": {
      "type": "string",
      "minLength": 1,
      "description": "One-line human summary of the scenario."
    },
    "include": {
      "type": "array",
      "description": "Profiles applied before this one, by name; the applying tool resolves them as it resolves a selected profile. Includes nest depth-first, every profile applies once, and a cycle is an error.",
      "uniqueItems": true,
      "items": {
        "type": "string",
        "pattern": "^[A-Za-z0-9][A-Za-z0-9._-]*$"
      }
    },
    "authx": {
      "$ref": "#/$defs/authx"
    },
    "apiUsers": {
      "type": "array",
      "description": "API users asserted after install (idempotent by username); credentials are supplied or issued by the applying tool, never stored in the profile.",
      "items": {
        "$ref": "#/$defs/apiUser"
      }
    },
    "dependencies": {
      "type": "array",
      "description": "Extensions the scenario needs. Applied in array order (deps before dependents).",
      "items": {
        "$ref": "#/$defs/dependency"
      }
    },
    "config": {
      "$ref": "#/$defs/config"
    },
    "seed": {
      "$ref": "#/$defs/seed"
    },
    "scripts": {
      "$ref": "#/$defs/scripts"
    },
    "snapshot": {
      "$ref": "#/$defs/snapshot"
    }
  },
  "$defs": {
    "snapshot": {
      "type": "object",
      "additionalProperties": false,
      "description": "Generate this profile's data once and restore it from a stored database snapshot on later fresh boots, with every date shifted to today. Generators date records relative to CK_SEED_TODAY and size them by CK_SEED_SIZE. Restored on the standalone image only; elsewhere the profile applies as without this block.",
      "properties": {
        "calendar": {
          "enum": ["year", "month", "none"],
          "default": "year",
          "description": "The coarsest calendar period the data relies on (\"last year\", \"this month\"). A snapshot is valid only while today lies in the period it was generated in; none means relative day windows only."
        },
        "sizes": {
          "type": "array",
          "minItems": 1,
          "uniqueItems": true,
          "default": ["demo"],
          "items": {
            "type": "string",
            "pattern": "^[a-z0-9][a-z0-9_-]*$"
          },
          "description": "The CK_SEED_SIZE values the generators support. Default: [\"demo\"]."
        },
        "after_restore": {
          "type": "array",
          "description": "PHP scripts run as the admin user after a restore, in list order and in one process, e.g. jobs that fill reporting tables. Paths are relative to the profile file's directory and must stay inside it.",
          "items": {
            "type": "string",
            "minLength": 1
          }
        }
      }
    },
    "dependency": {
      "type": "object",
      "additionalProperties": false,
      "required": ["name"],
      "description": "One extension. Source is git (`repo` + `version`), the civicrm.org registry (`registry: true`), or core-bundled (neither — enable only).",
      "properties": {
        "name": {
          "type": "string",
          "minLength": 1,
          "pattern": "^[A-Za-z0-9][A-Za-z0-9._-]*$",
          "description": "Extension key (e.g. de.systopia.xcm)."
        },
        "repo": {
          "type": "string",
          "format": "uri",
          "description": "Git URL — cloned at `version` into the site's ext dir."
        },
        "registry": {
          "type": "boolean",
          "description": "true = fetch a packaged release from the civicrm.org registry (cv ext:download)."
        },
        "version": {
          "type": "string",
          "minLength": 1,
          "description": "Git ref (tag/branch/commit) to check out. Only meaningful with `repo`."
        },
        "enable": {
          "type": "boolean",
          "description": "Enable the extension after install (cv ext:enable). Absent/false = fetch only."
        },
        "skip": {
          "type": "boolean",
          "description": "Leave this extension unmanaged: never auto-install, update, or remove it. For locally-patched or manually-maintained extensions."
        },
        "skipUf": {
          "type": "array",
          "uniqueItems": true,
          "items": {
            "enum": ["Standalone", "Drupal", "Drupal8", "WordPress", "Backdrop", "Joomla"]
          },
          "description": "Host CMS frameworks (CIVICRM_UF values) on which this extension is neither fetched nor enabled."
        },
        "skipUfReason": {
          "type": "string",
          "minLength": 1,
          "description": "Human-readable reason for skipUf, shown as a SKIP line in the boot log."
        }
      },
      "dependentRequired": {
        "repo": ["version"],
        "version": ["repo"],
        "skipUfReason": ["skipUf"]
      },
      "dependentSchemas": {
        "registry": {
          "description": "Registry-sourced: no git repo or git version — the release picks its own version.",
          "properties": {
            "repo": false,
            "version": false
          }
        }
      }
    },
    "config": {
      "type": "object",
      "additionalProperties": false,
      "description": "Instance configuration asserted on every apply (overwrite): whatever differs is written back, so drift is corrected each run. Applied after dependencies, before seed.",
      "properties": {
        "settings": {
          "type": "object",
          "description": "CiviCRM Settings (Setting.set), asserted every run — e.g. environment: Staging (jobs refused + mail off). Applied first. enable_components is the whole list; config.components adds to it instead. An unknown setting is an error."
        },
        "components": {
      "type": "array",
      "description": "Core components switched on, additively: the others keep their state, so profiles combine. Applied after settings, before the rest. A name core does not know (CiviContribute, CiviMember, CiviEvent, CiviMail, CiviPledge, CiviCase, CiviReport, CiviCampaign) is an error.",
      "uniqueItems": true,
      "items": {
        "type": "string",
        "minLength": 1
      }
    },
    "domain_name": {
          "type": "string",
          "minLength": 1,
          "description": "Default organization / domain name."
        },
        "from_email": {
          "type": "string",
          "minLength": 1,
          "description": "Default from-address; replaces the fresh-install EXAMPLE.ORG placeholder."
        },
        "mailbox_domain": {
          "type": "string",
          "minLength": 1,
          "description": "Incoming mailbox domain (MailSettings)."
        },
        "groups": {
          "type": "array",
          "description": "Groups asserted by machine name (idempotent).",
          "items": {
            "type": "object",
            "additionalProperties": false,
            "required": ["name"],
            "properties": {
              "ref": {
                "type": "string",
                "minLength": 1,
                "description": "Stable handle to cross-link seed contacts to this group."
              },
              "name": {
                "type": "string",
                "minLength": 1,
                "description": "Machine name — the idempotent match key."
              },
              "title": {
                "type": "string",
                "minLength": 1
              }
            }
          }
        },
        "membership_types": {
          "type": "array",
          "description": "Membership types asserted by name (idempotent), owned by the domain organization. Requires CiviMember and an existing financial type; either missing is an error.",
          "items": {
            "type": "object",
            "additionalProperties": false,
            "required": ["name", "financial_type"],
            "properties": {
              "name": {
                "type": "string",
                "minLength": 1,
                "description": "Machine name — the idempotent match key."
              },
              "financial_type": {
                "type": "string",
                "minLength": 1,
                "description": "Financial type by name, e.g. Member Dues."
              },
              "period_type": {
                "enum": ["rolling", "fixed"],
                "description": "Default: rolling. fixed needs fixed_period_start_day."
              },
              "fixed_period_start_day": {
                "type": "integer",
                "minimum": 101,
                "maximum": 1231,
                "description": "Start of a fixed period as MMDD, e.g. 101 for 1 January."
              },
              "duration_unit": {
                "enum": ["day", "month", "year"],
                "description": "Default: year."
              },
              "duration_interval": {
                "type": "integer",
                "minimum": 1,
                "description": "Default: 1."
              },
              "minimum_fee": {
                "type": "number",
                "minimum": 0,
                "description": "Default: 0."
              },
              "is_active": {
                "type": "boolean",
                "description": "Default: true."
              }
            }
          }
        }
      }
    },
    "seed": {
      "type": "object",
      "additionalProperties": false,
      "description": "Sample content created once and never overwritten (UI edits survive re-apply). A record is matched by its anchor, deleted ones included, so a trashed seed record is not recreated. Every missing prerequisite (unknown field, group, financial type, contact ref, disabled component) is listed and nothing is written.",
      "properties": {
        "contacts": {
          "type": "array",
          "description": "Anchored fixture contacts, created with their primary email and group memberships. Any other APIv4 Contact field may be set as an extra property; an unknown one is an error.",
          "items": {
            "type": "object",
            "required": ["ref"],
            "properties": {
              "ref": {
                "type": "string",
                "minLength": 1,
                "description": "Doubles as external_identifier — the idempotent match key."
              },
              "contact_type": {
                "type": "string",
                "minLength": 1,
                "description": "Default: Individual."
              },
              "email": {
                "type": "string",
                "minLength": 1
              },
              "groups": {
                "type": "array",
                "items": {
                  "type": "string",
                  "minLength": 1
                },
                "description": "Group refs (config.groups[].ref) or bare group names."
              }
            }
          }
        },
        "contributions": {
          "type": "array",
          "description": "Contributions linked to seed contacts, created once. The anchor is trxn_id profile-seed-<ref>, or profile-seed-<contact_ref>-<n> (n = 1-based position in this list) without a ref. Requires CiviContribute. Any other APIv4 Contribution field may be set as an extra property; an unknown one is an error.",
          "items": {
            "type": "object",
            "required": ["contact_ref", "total_amount", "financial_type_id:name"],
            "properties": {
              "ref": {
                "type": "string",
                "minLength": 1,
                "description": "Optional stable handle (used to build the idempotent trxn_id)."
              },
              "contact_ref": {
                "type": "string",
                "minLength": 1,
                "description": "A seed.contacts[].ref, or the external_identifier of a contact that already exists."
              },
              "total_amount": {
                "type": "number"
              },
              "financial_type_id:name": {
                "type": "string",
                "minLength": 1,
                "description": "Financial type by name, e.g. Donation. A numeric financial_type_id is not accepted."
              }
            }
          }
        }
      }
    },
    "scripts": {
      "type": "array",
      "description": "Imperative PHP scripts (run via `cv scr` as the admin user), applied in list order AFTER config and seed. The escape hatch for volume / complex fixtures that config/seed cannot express (a year of history, generated records, mandates). Each entry is a path relative to the profile file's directory and must stay inside it. Only listed files run; a seeds/ directory next to profile.json is an error. A consumer that only wants the declarative tier ignores it.",
      "items": {
        "type": "string",
        "minLength": 1
      }
    },
    "contentProfile": {
      "type": "object",
      "additionalProperties": false,
      "description": "A standalone declarative content document (authx + apiUsers + config + seed + optional scripts) applied to an existing instance by another tool. A full profile embeds the same shape inline.",
      "properties": {
        "authx": {
          "$ref": "#/$defs/authx"
        },
        "apiUsers": {
          "type": "array",
          "description": "API users asserted after install (idempotent by username); credentials are supplied or issued by the applying tool, never stored in the profile.",
          "items": {
            "$ref": "#/$defs/apiUser"
          }
        },
        "config": {
          "$ref": "#/$defs/config"
        },
        "seed": {
          "$ref": "#/$defs/seed"
        },
        "scripts": {
          "$ref": "#/$defs/scripts"
        }
      }
    },
    "authx": {
      "type": "object",
      "additionalProperties": false,
      "required": ["header_cred"],
      "description": "AuthX configuration for headless API access.",
      "properties": {
        "header_cred": {
          "type": "array",
          "minItems": 1,
          "uniqueItems": true,
          "contains": {
            "enum": ["api_key", "pass"]
          },
          "items": {
            "enum": ["jwt", "api_key", "pass"]
          },
          "description": "Accepted credential flows in the Authorization header. Must include api_key or pass because CiviKitchen does not issue JWTs for generated users."
        }
      }
    },
    "apiUser": {
      "type": "object",
      "additionalProperties": false,
      "required": ["username", "role", "permissions"],
      "properties": {
        "username": {
          "type": "string",
          "minLength": 1,
          "maxLength": 60,
          "pattern": "^[A-Za-z][A-Za-z0-9._-]*$",
          "description": "Cross-CMS login name. Delimiters and control characters are forbidden so the credentials record remains unambiguous."
        },
        "role": {
          "type": "string",
          "minLength": 1,
          "maxLength": 60,
          "pattern": "^civikitchen_[a-z0-9_]+$",
          "description": "CiviKitchen-owned CMS role machine name. The reserved prefix permits exact reconciliation without mutating unrelated site roles."
        },
        "permissions": {
          "type": "array",
          "minItems": 1,
          "items": {
            "type": "string",
            "minLength": 1
          },
          "description": "CiviCRM permission strings granted to the user's role."
        }
      },
      "description": "One API user: a CMS role carrying exactly these CiviCRM permissions and a user in it. The credential (api key) is never part of a profile — the applying tool supplies or issues it."
    }
  }
}
