{
  "description": "Musterverein e.V. with core only: membership types, members with addresses and last year's fees",
  "dependencies": [],
  "config": {
    "settings": {"defaultCurrency": "EUR"},
    "components": ["CiviContribute", "CiviMember"]
  },
  "snapshot": {"calendar": "year", "sizes": ["demo"]},
  "scripts": ["scripts/10-verein.php"]
}
