{
  "description": "Past and upcoming events with participants in varied statuses, core only",
  "dependencies": [],
  "config": {
    "settings": {"defaultCurrency": "EUR"},
    "components": ["CiviEvent"]
  },
  "snapshot": {"calendar": "none", "sizes": ["demo"]},
  "scripts": ["scripts/10-events.php"]
}
