{
  "description": "Segmented newsletter groups, subscribers and a draft mailing, core only",
  "dependencies": [],
  "config": {
    "settings": {"defaultCurrency": "EUR"},
    "components": ["CiviMail"]
  },
  "snapshot": {"calendar": "none", "sizes": ["demo"]},
  "scripts": ["scripts/10-mailing.php"]
}
